{
  "schemaVersion": "nodevideo.creatorbench-freeze/v1",
  "id": "creatorbench-freeze:37b596c88293fbab06b9d9fb",
  "benchmarkVersion": "creatorbench-v1",
  "frozenAt": "2026-07-22T06:15:17.730Z",
  "sourceCommitSha": "a42851e1a60e8d5847287fba2277985e6a678ea7",
  "configHash": "sha256:20929e9cc64c3bf88a6018bede9a4ee81d0e2375d1c9c593c4db32174fe1872c",
  "capabilityManifestHash": "sha256:164094f6341a7788eb95b045d8960093ecdac5e6c374f17837c4168277ff32f0",
  "routerPolicyHash": "sha256:266bd6b36cfa2e11fd62299bdf37823c4f532a88106661f8ae9aaa19d37a1437",
  "thresholdPolicyHash": "sha256:5338c6b661fe925a617b21c98a9601ea79cfc3b07e1bee18d431c1181577387d",
  "benchmarkManifestHash": "sha256:2fdb4411debf43016843251b8ad471709e74d63ba53c4c667d2c69cd24a46623",
  "evaluatorVersion": "creatorbench-evaluator-v1",
  "evaluatorHash": "sha256:20edee497866d1d445c9eaf64833083ad6465ef66e34469c1fa89f6cf6a4370c",
  "modelVersions": [
    "none:routing-baseline"
  ],
  "executorVersions": [
    "adaptive-executor-router-v1",
    "executor-catalog-v1"
  ],
  "privateSplit": {
    "catalogHash": "sha256:6bf6fdf4d5bc0da740d869a96ef4ec683445f909ef634b31af1ec9149879722a",
    "mediaStoredOutsideRepository": true,
    "developmentCredentialsDenied": true
  }
}
